{
  "prompt": "Qu’avez-vous remarqué cette semaine quand vous avez essayé de vous affirmer?",
  "questions": [
    { "id": "situation", "text": "Voulez-vous décrire un moment précis : où vous étiez et ce qui a été dit ?" },
    { "id": "action", "text": "Voulez-vous ajouter ce que vous avez dit ou fait ?" },
    { "id": "next_step", "text": "Voulez-vous nommer une chose à essayer la prochaine fois ?" },
    { "id": "when", "text": "Voulez-vous préciser quand vous l'essaierez ?" }
  ],
  "complete": "Vous avez décrit une situation, votre réaction et quoi essayer ensuite, en précisant quand.",
  "support": "Si ça vous pèse, parlez à une personne de confiance, au programme d'aide aux employés de votre milieu de travail ou à un service de soutien local.",
  "supportNote": "Si quelque chose vous pèse, parlez à une personne de confiance, au programme d’aide aux employés de votre milieu de travail ou à un service de soutien local.",
  "saved": "Enregistrée dans ce navigateur",
  "changed": "L’entrée a changé. Sélectionnez Obtenir une suggestion pour la nouvelle version."
}
